{
  "schema_version": "1.0",
  "approval": {
    "approval_id": "approval-second-cathedral-mosque-ulyanovsk-2026-002",
    "decision": "approved",
    "actor": "approver:ulyanovsk-mosques:akhmedov-elmaddin-fazil-ogly",
    "approved_at": "2026-08-29T12:12:00Z",
    "scope": "Вторая Соборная мечеть Ульяновска; 2026 год; фото приоритетно для августа; азан Зухра — onset из источника; икамат Фаджра/Асра/Магриба/Иша — азан +5 мин; икамат Зухра ежедневно и Джума по пятницам — единое время 13:15; исключений Рамадана/праздников нет; предупреждения приняты.",
    "reason": "Утверждено ответственным представителем мечетей Ульяновска Ахмедовым Эльмаддином Фазил Оглы.",
    "candidate_id": "candidate-e7bcc16ad55d00f136cbfc5629e2680b",
    "raw_sha256": "c7d95bbc900a683b3be4fa66f6d1a8237ccf3e882452674a2cdd946c800d935a",
    "transcription_sha256": "94ef664fafa69192992b7bc5b405baa6678d5a49c8f6b1c770c0281760d60e4f",
    "normalized_sha256": "e7bcc16ad55d00f136cbfc5629e2680babf3f71b331dd33ca4f6e1b1207dbf77",
    "diff_sha256": "de139a27b2f0f5b42253783f5a4aeca11d2f643bee572d860e2c4c24564d7e4e",
    "parser_version": "effective-schedule/v1",
    "prayer_policy_sha256": "6b8ce3c01001d41162f18d5fb26d6a68251ce2d60a5f7598c5c96b06b51aa629",
    "acknowledged_warning_codes": [
      "day_to_day_delta",
      "mosque_iqamah_approval_required",
      "source_marker_preserved"
    ]
  },
  "prayer_policy_sha256": "6b8ce3c01001d41162f18d5fb26d6a68251ce2d60a5f7598c5c96b06b51aa629",
  "approval_key_id": "ulyanovsk-approver-akhmedov-2026-01",
  "signature_ed25519_base64": "AWZw1GEiANw23H8rAgeX++vYG+TIQa+ZaHVXZr2ONM05/XHsR7EnhsNZEDep51MwYj1g8LjdpzhFzGU2nokZCg=="
}
